{"$schema":"http://json-schema.org/draft-07/schema#","title":"run-receipt.v1","type":"object","additionalProperties":false,"required":["schema","work_id","node_gid","source_commit","outcome","attempts","artifact","chain","published_path","recorded_at"],"anyOf":[{"properties":{"outcome":{"const":"accepted"},"artifact":{"type":"object","additionalProperties":false,"required":["path","content_digest"],"properties":{"path":{"type":"string","pattern":"^(?!.*\\x00)(?!/)(?![A-Za-z]:)(?!.*\\\\)(?!\\.\\.(/|$))(?!.*(^|/)\\.\\.(/|$)).+$"},"content_digest":{"type":"string","pattern":"^[0-9a-f]{64}$"}}},"chain":{"properties":{"candidates":{"type":"array","minItems":1},"verdicts":{"type":"array","minItems":1},"reviews":{"type":"object","required":["correctness","value","falsification"]}}},"published_path":{"type":"string","pattern":"^(?!.*\\x00)(?!/)(?![A-Za-z]:)(?!.*\\\\)(?!\\.\\.(/|$))(?!.*(^|/)\\.\\.(/|$)).+$"}},"required":["outcome","artifact","chain","published_path"]},{"properties":{"outcome":{"const":"dead-letter"},"artifact":{"type":"null"},"published_path":{"type":"null"}},"required":["outcome","artifact","published_path"]}],"properties":{"schema":{"const":"run-receipt.v1"},"work_id":{"type":"string","pattern":"^[0-9a-f]{64}$"},"node_gid":{"type":"string"},"source_commit":{"type":"string","pattern":"^[0-9a-f]{40}$"},"outcome":{"enum":["accepted","dead-letter"]},"attempts":{"type":"integer","minimum":1},"artifact":{"anyOf":[{"type":"object","additionalProperties":false,"required":["path","content_digest"],"properties":{"path":{"type":"string","pattern":"^(?!.*\\x00)(?!/)(?![A-Za-z]:)(?!.*\\\\)(?!\\.\\.(/|$))(?!.*(^|/)\\.\\.(/|$)).+$"},"content_digest":{"type":"string","pattern":"^[0-9a-f]{64}$"}}},{"type":"null"}]},"chain":{"type":"object","additionalProperties":false,"required":["snapshot_digest","candidates","verdicts","reviews","decision_digest"],"properties":{"snapshot_digest":{"type":"string","pattern":"^[0-9a-f]{64}$"},"candidates":{"type":"array","items":{"type":"object","additionalProperties":false,"required":["digest","attempt"],"properties":{"digest":{"type":"string","pattern":"^[0-9a-f]{64}$"},"attempt":{"type":"integer","minimum":1}}}},"verdicts":{"type":"array","items":{"type":"object","additionalProperties":false,"required":["digest","attempt"],"properties":{"digest":{"type":"string","pattern":"^[0-9a-f]{64}$"},"attempt":{"type":"integer","minimum":1}}}},"reviews":{"type":"object","additionalProperties":false,"properties":{"correctness":{"type":"object","additionalProperties":false,"required":["digest","attempt"],"properties":{"digest":{"type":"string","pattern":"^[0-9a-f]{64}$"},"attempt":{"type":"integer","minimum":1}}},"value":{"type":"object","additionalProperties":false,"required":["digest","attempt"],"properties":{"digest":{"type":"string","pattern":"^[0-9a-f]{64}$"},"attempt":{"type":"integer","minimum":1}}},"falsification":{"type":"object","additionalProperties":false,"required":["digest","attempt"],"properties":{"digest":{"type":"string","pattern":"^[0-9a-f]{64}$"},"attempt":{"type":"integer","minimum":1}}}}},"decision_digest":{"type":"string","pattern":"^[0-9a-f]{64}$"}}},"published_path":{"anyOf":[{"type":"string","pattern":"^(?!.*\\x00)(?!/)(?![A-Za-z]:)(?!.*\\\\)(?!\\.\\.(/|$))(?!.*(^|/)\\.\\.(/|$)).+$"},{"type":"null"}]},"recorded_at":{"type":"string","pattern":"^\\d{4}-\\d{2}-\\d{2}T[^ ]+Z$","format":"date-time"}}}
