{"schema":"run-receipt.v1","work_id":"aaaaaaaaaaaaaaaaaaaaaaaaaaaaaaaaaaaaaaaaaaaaaaaaaaaaaaaaaaaaaaaa","node_gid":"n1","source_commit":"bbbbbbbbbbbbbbbbbbbbbbbbbbbbbbbbbbbbbbbb","outcome":"accepted","attempts":1,"artifact":{"path":"a","content_digest":"cccccccccccccccccccccccccccccccccccccccccccccccccccccccccccccccc"},"chain":{"snapshot_digest":"cccccccccccccccccccccccccccccccccccccccccccccccccccccccccccccccc","candidates":[{"digest":"cccccccccccccccccccccccccccccccccccccccccccccccccccccccccccccccc","attempt":1}],"verdicts":[{"digest":"cccccccccccccccccccccccccccccccccccccccccccccccccccccccccccccccc","attempt":1}],"reviews":{"correctness":{"digest":"1111111111111111111111111111111111111111111111111111111111111111","attempt":1},"value":{"digest":"2222222222222222222222222222222222222222222222222222222222222222","attempt":1},"falsification":{"digest":"3333333333333333333333333333333333333333333333333333333333333333","attempt":1}},"decision_digest":"cccccccccccccccccccccccccccccccccccccccccccccccccccccccccccccccc"},"published_path":"out/a","recorded_at":"2026-01-01T00:00:00Z"}
